,Name,Author,Rating,Number of Reviews,Price,Type
0,"PW Physics Med Easy Notes | Notes, Formulas, Mnemonics, Tips & Tricks for NEET/JEE & Board Exams | MR Sir Physics Handwritten Notes",Dr. Manish Raj (MR. Sir),4.9 out of 5 stars,"1,096",₹421.00,Paperback
1,Don't Believe Everything You Think (English),Joseph Nguyen,4.5 out of 5 stars,"2,992",₹169.00,Paperback
2,"Do It Today: Overcome procrastination, improve productivity and achieve more meaningful things [Paperback] Foroux, Darius",Darius Foroux,4.4 out of 5 stars,"7,691",₹139.00,Paperback
3,Atomic Habits: the life-changing million-copy #1 bestseller,James Clear,4.6 out of 5 stars,"85,473",₹449.00,Paperback
4,The Psychology Of Money,Morgan Housel,4.6 out of 5 stars,"55,388",₹250.00,Paperback
5,BRAHMASTRA Complete Maths Multicolored Formula Book Second Edition BILINGUAL by Aditya Ranjan Sir,Aditya Ranjan Sir,4.8 out of 5 stars,131,₹120.00,Paperback
6,The Power of Your Subconscious Mind,Joseph Murphy,4.5 out of 5 stars,"78,522",₹104.00,Paperback
7,Ikigai,Francesc Miralles,4.6 out of 5 stars,"51,013",₹354.00,Hardcover
8,My First Library: Boxset of 10 Board Books for Kids,Wonder House Books,4.5 out of 5 stars,"73,465",₹398.00,Board book
9,Brain Activity Book for Kids - 200+ Activities for Age 3+,Maple Press,4.4 out of 5 stars,"4,516",₹85.00,Paperback
10,"NTA UGC NET /SET/JRF Paper 1, Teaching and Research Aptitude – 2023, Includes latest 2022 paper and 2600+ Practice Questions with Solutions | Includes NEP - 2020| 7th Edition - By Pearson",KVS Madaan,4.4 out of 5 stars,673,₹319.00,Paperback
11,"Moral Story Books for Kids (Illustrated) - English Short Stories with Colourful Pictures - Bedtime Children Story Book - 3 Years to 6 Years Old Children - Read Aloud to Infants, Toddlers (Set of 10 Books)",Maple Press,4.5 out of 5 stars,"1,881",₹199.00,Product Bundle
12,How to Win Friends and Influence People,Dale Carnegie,4.5 out of 5 stars,"89,463",₹89.00,Paperback
13,Diary of a Wimpy Kid,Jeff Kinney,4.7 out of 5 stars,455,₹412.00,Hardcover
14,Indian Polity for UPSC (English| 7th Edition) |Civil Services Exam| State Administrative Exams,M Laxmikanth,4.6 out of 5 stars,560,₹669.00,Paperback
15,SSC GD (COMBO) MATH +REASONING+GK+HINDI,Ankit Bhati,4.3 out of 5 stars,16,₹469.00,Paperback
16,"Friends, Lovers and the Big Terrible Thing: 'Funny, fascinating and compelling' The Times",Matthew Perry,4.4 out of 5 stars,"19,274","₹1,499.00",Paperback
17,"Little Colouring Books for Kids (Set of 10 Books) - Gift to children for painting, drawing and colouring - Alphabets, Animals, Birds, Flags, Flowers, ... Transport, Vegetables - 3 to 6 years old [Paperback] Maple Press",Maple Press,4.3 out of 5 stars,"3,276",₹177.00,Paperback
18,"Grandma's Bag of Stories: Collection of 20+ Illustrated short stories, traditional Indian folk tales for all ages for children of all ages by Sudha Murty [Paperback] Sudha Murty",Murty Sudha,4.6 out of 5 stars,"20,171",₹162.00,Paperback
19,Colouring Books for Kids (Pack of 12 Books),Wonder House Books,4.5 out of 5 stars,"3,913",₹328.00,Paperback
20,"My First Mythology Tale (Illustrated) (Set of 5 Books) - Mahabharata, Krishna, Hanuman, Ganesha, Ramayana - Story Book for Kids - English Short Stories with Colourful Pictures - Read Aloud to Infants, Toddlers",Maple Press,4.4 out of 5 stars,"7,843",₹160.00,Paperback
21,"Oxford Student Atlas for India, Fourth Edition - Useful for Competitive Exams",Oxford University Press,4.5 out of 5 stars,"3,898",₹250.00,Paperback
22,You Can,George Matthew Adams,4.3 out of 5 stars,"4,244",₹98.00,Paperback
23,My First Book of Patterns Pencil Control: Practice Patterns (Pattern Writing),Wonder House Books,4.4 out of 5 stars,"26,000",₹88.00,Paperback
24,Rich Dad Poor Dad: 25th Anniversary Edit: (25th Anniversary Edition),Robert T. Kiyosaki,4.5 out of 5 stars,"26,370",₹349.00,Mass Market Paperback
25,Shrimad Bhagwat Geeta Yatharoop,A.C. Bhaktivendanta Swami Prabhupada,4.8 out of 5 stars,"17,549",₹240.00,Hardcover
26,"Disha 144 JEE Main Online (2023-2012) & Offline (2018-2002) Physics,Chemistry & Mathematics Chapter-wise+Topic-wise Previous Years Solved Papers 7th Edition NCERT Chapterwise PYQ Question Bank",Disha Experts,4.3 out of 5 stars,302,"₹1,315.00",Paperback
27,201 Brain Booster Activity Book Fun Activities and Exercises For Children Tracing and Pattern Colors and Shapes Maze,Wonder House Books,4.4 out of 5 stars,275,₹99.00,Paperback
28,"Think Straight: Change your thoughts, Change your life [Paperback] Foroux, Darius",Darius Foroux,4.2 out of 5 stars,"12,481",₹125.00,Paperback
29,India that is Bharat,J Sai Deepak,4.8 out of 5 stars,"6,650",₹375.00,Hardcover
30,Twelfth Fail: Hara Vahi Jo Lada Nahi,Anurag Pathak,4.7 out of 5 stars,729,₹143.00,Paperback
31,"PW Chemistry Med Easy | Notes, Formulas, Tips & Tricks for NEET/JEE & Board Exams | Pankaj Sir Chemistry Handwritten Notes",Pankaj Sijairya,4.6 out of 5 stars,134,₹367.00,Paperback
32,"Courage To Be Disliked, The: How to free yourself, change your life and achieve real happiness (Courage To series)",Ichiro Kishimi and Fumitake Koga,4.5 out of 5 stars,"11,735",₹282.00,Hardcover
33,World's Greatest Pack for Personal Growth and Wealth (Set of 4 Books),Dale Carnegie,4.5 out of 5 stars,"25,014",₹327.00,Paperback
34,BlackBook of English Vocabulary March 2023 by Nikhil Gupta,Nikhil K.R. Gupta,4.5 out of 5 stars,"1,793",₹250.00,Paperback
35,THE CONCISE 48 LAWS OF POWER,Robert Greene,4.4 out of 5 stars,"5,601",₹254.00,Paperback
36,"THE SILENT PATIENT [Paperback] Michaelides, Alex",Alex Michaelides,4.5 out of 5 stars,"270,019",₹160.00,Paperback
37,The 5 Am Club,Robin Sharma,4.5 out of 5 stars,"30,251",₹202.00,Paperback
38,"Sank Magic Practice Copybook, (4 BOOK + 10 REFILL+ 1 Pen +1 Grip) Number Tracing Book for Preschoolers with Pen, Magic Calligraphy Copybook Set Practical Reusable Writing Tool Simple Hand Lettering",Sank Magic,3.9 out of 5 stars,847,₹114.00,Spiral-bound
39,"The Hidden Hindu Book 3 ""द हिडन हिंदू-3"" - अक्षत गुप्ता 3rd Book of Hidden Hindu Triology (Hindi Version) - Akshat Gupta",Akshat Gupta,4.8 out of 5 stars,37,₹179.00,Paperback
40,Think And Grow Rich - Hindi,Napoleon Hill,4.4 out of 5 stars,"9,872",₹89.00,Paperback
41,Man's Search For Meaning: The classic tribute to hope from the Holocaust,Victor E. Frankl,4.5 out of 5 stars,"82,185",₹196.00,Paperback
42,Shlokas and Mantras Activity Book For Kids Illustrated Book With Engaging Activities and Sticker Sheets,Wonder House Books,4.7 out of 5 stars,351,₹149.00,Hardcover
43,THE 48 LAWS OF POWER,Robert Greene,4.6 out of 5 stars,"18,104",₹559.00,Paperback
44,Animal Stories for Panchtantra 84 pp English 8x8 Book 1,Wonder House Books,4.5 out of 5 stars,"4,820",₹188.00,Hardcover
45,"My First 1000 Words : Early Learning Picture Book to learn Alphabet, Numbers, Shapes and Colours, Tr",Wonder House Books,4.5 out of 5 stars,"8,029",₹158.00,Paperback
46,29 Previous Years UPSC Civil Services IAS Prelims Topic-wise Solved Papers 1 & 2 (1995 - 2023) 14th Edition | General Studies & Aptitude (CSAT) PYQs Question Bank |,Mrunal Patel,4.3 out of 5 stars,348,₹415.00,Paperback
47,Autobiography of a Yogi (Complete Original Edition),Paramahansa Yogananda,4.6 out of 5 stars,"9,543",₹126.00,Paperback
48,1001 Ultimate Brain Booster Activities for 3 to 6 Years Old Kids |Enhance the Child Mind with Cognitive Excellence with Interactive Activity Book,Team Pegasus,4.6 out of 5 stars,684,₹259.00,Paperback
49,Oswaal CBSE Sample Question Papers Class 10 Mathematics Standard Book (For 2024 Exam),Oswaal Editorial Board,4.8 out of 5 stars,65,₹288.00,Paperback
50,"Quantitative Aptitude for Competitive Examinations All Government and Entrance Exams (Banking, SSC, Railway, Police, Civil Service, etc.) 40 Videos | 2000+ Solved Examples | 10000+ Practice Questions",R. S Aggarwal,4.3 out of 5 stars,"1,799",₹440.00,Paperback
51,Oswaal CBSE Class 10 Science Question Bank (For 2024 Board Exams),Oswaal Editorial Board,4.4 out of 5 stars,520,₹477.00,Paperback
52,All In One Class 10th Social Science for CBSE Exam 2024,Farah Sultan Aditya Raj ,4.3 out of 5 stars,443,₹329.00,Paperback
53,"Tuesdays With Morrie: An old man, a young man, and life's greatest lesson [Paperback] Albom, Mitch",Mitch Albom,4.6 out of 5 stars,"23,636",₹190.00,Paperback
54,"Think And Grow Rich [Original Edition (Complete), PREMIUM PAPERBACK]",Napoleon Hill,4.4 out of 5 stars,"73,073",₹99.00,Paperback
55,The Power of A Positive Attitude: Your Road To Success,Roger Fritz,4.4 out of 5 stars,"4,052",₹98.00,Paperback
56,Shlokas and Mantras For Kids - Illustrated Padded Board Book - Learn About India's Rich Culture and,Wonder House Books,4.7 out of 5 stars,350,₹198.00,Board book
57,"Story Books for Kids (Set of 5 Books) (Illustrated) - Indian Scientists - Biographies for Children - 6 Years to 10 Years Old - CV Raman, Homi Bhabha, Ramanujan, Vikram Sarabhai, Abdul Kalam",Maple Press,4.4 out of 5 stars,161,₹130.00,Paperback
58,"Writing Fun A Set Of 4 Books : Write And Practice Capital Letters, Small Letters and Numbers 1 to 2",Wonder House Books,4.3 out of 5 stars,"11,876",₹199.00,Paperback
59,"Energize Your Mind : Learn the Art of Mastering Your Thoughts, Feelings and Emotions",Gaur Gopal Das,4.7 out of 5 stars,"2,795",₹170.00,Paperback
60,Tales from Indian Mythology Collection of 10 Books Story Books For Kids,Wonder House Books,4.4 out of 5 stars,438,₹329.00,Paperback
61,The Autobiography of God,Lenaa Kumar,4.8 out of 5 stars,22,₹474.00,Hardcover
62,Bhagvad Gita As It Is English New Edition,A. C. Bhaktivedanta Swami Prabhupad,4.8 out of 5 stars,"6,261",₹335.00,Hardcover
63,Oswaal CBSE Sample Question Papers Class 10 Science Book (For 2024 Exam),Oswaal Editorial Board,4.4 out of 5 stars,54,₹293.00,Paperback
64,"THE POWER OF YOUR SUBCONSCIOUS MIND [Original Edition (Complete), PREMIUM PAPERBACK]",Joseph Murphy,4.5 out of 5 stars,"78,522",₹126.00,Paperback
65,"Oswal - Gurukul Last Years 10 Solved Papers for CBSE Class 10 Exam 2024 - Yearwise Board Solutions of Math Standard, English, Science & Social Science (All Sets Delhi & Outside), Latest Syllabus",Oswal - Gurukul,4.4 out of 5 stars,282,₹720.00,Paperback
66,"The Art of Being Alone : Solitude is my Home, Loneliness was my Cage",Renuka Gavrani,4.3 out of 5 stars,58,₹249.00,Paperback
67,The Subtle Art of Not Giving a F*ck: A Counterintuitive Approach to Living a Good Life,Mark Manson,4.5 out of 5 stars,"138,134",₹203.00,Paperback
68,Word Power Made Easy By Norman Lewis (More than 700 Pages),Norman Lewis,4.4 out of 5 stars,"2,097",₹83.00,Paperback
69,"All Time Favourites for Children: Classic Collection of 25+ most-loved, great stories by famous award-winning author (Illustrated, must-read fiction short stories for kids)",Ruskin Bond,4.6 out of 5 stars,"1,885",₹149.00,Paperback
70,"MTG 36 Years NEET Previous Year Solved Question Papers with NEET PYQ Chapterwise Topicwise Solutions - Physics, Chemistry & Biology For NEET Exam 2024 | Get Free access of Smart Book (Set of 3 Books)",MTG Editorial Board,4.4 out of 5 stars,922,₹779.00,Paperback
71,The Magic Of The Lost Temple**,Sudha Murty,4.6 out of 5 stars,"9,392",₹167.00,Paperback
72,"The Hidden Hindu: Science-Fiction meets Indian mythology in a nail biting thriller set in 2020 [Paperback] Gupta, Akshat",Akshat Gupta,4.4 out of 5 stars,"2,698",₹157.00,Paperback
73,The Hidden Hindu (Hindi Translation of The Hidden Hindu) Paperback,Akshat Gupta,4.4 out of 5 stars,"1,426",₹142.00,Paperback
74,"My First Learning Library Box Set [ Includes 20 Board Books] – Early Learning Books for Children with Well-researched Bright Images | Introduction to Basic Topics | Builds Child’s Vocabulary | Improves Hand-Eye Coordination, Recognition Skills and Enhances Visual Motor Skills | Round Corners for Safety| Sturdy Board Material",Wonder House Books,4.6 out of 5 stars,"14,425",₹799.00,Board book
75,As a Man Thinketh,James Allen,4.4 out of 5 stars,"11,855",₹68.00,Paperback
76,"Phonic Reader (Illustrated) (Set of 6 Books) - Story Book for Kids - Bedtime Stories - 2 Years to 6 Years Old - Read Aloud to Infants, Toddlers",Maple Press,4.2 out of 5 stars,549,₹150.00,Paperback
77,1800+ Reward Stickers Ideal For Teachers And Parents Sticker Book With Over 1800 Stickers to Boost The Morale of Kids,Wonder House Books,4.5 out of 5 stars,"1,571",₹158.00,Paperback
78,Life's Amazing Secrets: How to find Bala,Gaur Gopal Das,4.6 out of 5 stars,"22,677",₹145.00,Paperback
79,"Oswaal CBSE Sample Question Papers Class 10 English, Science, Social Science & Maths Standard (Set of 4 Books) (For Board Exams 2024) | 2023-24",Oswaal Editorial Board,4.2 out of 5 stars,19,"₹1,164.00",Product Bundle
80,CGL Practice King 3000+ TCS MCQ | Chapter Wise | Gagan Pratap Sir | Champion Publication,Gagan Pratap,5.0 out of 5 stars,1,₹299.00,Perfect Paperback
81,Aapke Avchetan Man Ki Shakti(Hindi Translation of The Power of Your Subconscious Mind),Joseph Murphy,4.4 out of 5 stars,"13,623",₹89.00,Paperback
82,KARMA: A YOGI'S GUIDE TO CRAFTING YOUR DESTINY,Sadhguru,4.7 out of 5 stars,"14,706",₹168.00,Paperback
83,101 Copy Coloring: Fun Activity Book For Children,Wonder House Books,4.5 out of 5 stars,"1,727",₹148.00,Paperback
84,The Alchemist,Paulo Coelho,4.6 out of 5 stars,"141,810",₹280.00,Paperback
85,Meditations,Marcus Aurelius,4.3 out of 5 stars,"2,809",₹99.00,Paperback
86,Hindus in Hindu Rashtra (Eighth-Class Citizens and Victims of State- Sanctioned Apartheid),Anand Ranganathan,4.8 out of 5 stars,"1,045",₹169.00,Hardcover
87,"Thinking, Fast & Slow (L)",Daniel Kahneman,4.5 out of 5 stars,"28,174",₹361.00,Paperback
88,N/A,N/A,4.6 out of 5 stars,64,₹487.00,Product Bundle
89,Encyclopedia: Amazing Questions & Answers Science,Om Books Editorial Team,4.5 out of 5 stars,"3,188",₹126.00,Paperback
90,"BRAIN GAMES FOR CLEVER KIDS [Paperback] Moore, Gareth",Gareth Moore,4.3 out of 5 stars,"10,320",₹149.00,Paperback
91,Word Power Made Easy [Paperback] Norman Lewis,Norman Lewis,4.4 out of 5 stars,"47,403",₹106.00,Paperback
92,2023 - Edition - Lucent's General Knowledge - English Medium - Original Copy,Dr. Binay Karna,4.3 out of 5 stars,510,₹200.00,Paperback
93,"Dhan Sampatti Ka Manovigyan (The Psychology Of Money) [Paperback] Housel, Morgan and Asma",Morgan Housel,4.3 out of 5 stars,"2,901",₹144.95,Paperback
94,King of Greed: 3 (Kings of Sin),Ana Huang,4.3 out of 5 stars,"6,733",₹399.00,Paperback
95,Eat That Frog!: 21 Great Ways to Stop Procrastinating and Get More Done in Less Time [Paperback] Brian Tracy,TRACY BRIAN,4.6 out of 5 stars,"7,881",₹187.00,Paperback
96,"Best Books Series Set of 3 Hidden Hindu Triology | The Hidden Hindu + The Hidden Hindu 2 + The Hidden Hindu 3 | Saat Chiranjeevi ""सात चिरंजीवी"" Book in Hindi by Akshat Gupta- PB",Akshat Gupta,4.6 out of 5 stars,5,₹477.00,Paperback
97,"Arihant CBSE Sample Question Papers Science, Social Science, Mathematics Standard & English Class 10 (Set of 4 Books) For 2024 Board Exams","Rudraksh Tripathi Punya Pratap, Pooja Yadav, Anuksha Arora Sunil Rathore, Chanchal Sharma",4.2 out of 5 stars,32,₹769.00,Paperback
98,Oswaal CBSE Class 10 Mathematics Standard Question Bank (For 2024 Board Exams),Oswaal Editorial Board,4.3 out of 5 stars,329,₹477.00,Paperback
99,"MTG Objective NCERT at your FINGERTIPS Biology - NCERT Notes with HD Pages, Based on NCERT Exam Archive Questions, NEET Books (Latest & Revised Edition 2023-2024)",MTG Editorial Board,4.5 out of 5 stars,906,₹602.00,Paperback
100,Think and Grow Rich THE 21st CENTURY EDITION,Napoleon Hill,4.5 out of 5 stars,"4,962",₹98.00,Paperback
101,Grandparents' Bag of Stories [Paperback] Sudha Murty,Murty Sudha,4.7 out of 5 stars,"4,957",₹162.00,Paperback
102,All In One Class 10th Science for CBSE Exam 2024,"Sanubia & Rashmi Gupta Sonal Singh & Ruchi Kapoor , Imran Ahmad ",4.3 out of 5 stars,344,₹378.00,Paperback
103,"MTG International Mathematics Olympiad (IMO) Workbook for Class 2 - MCQs, Previous Years Solved Paper and Achievers Section - SOF Olympiad Preparation Books For 2023-2024 Exam",MAHABIR SINGH,4.4 out of 5 stars,232,₹65.00,Paperback
104,Never Split the Difference : Negotiating as if Your Life Depended on It,Chris Voss,4.6 out of 5 stars,"39,653",₹385.00,Paperback
105,My First Padded Board Books of Nursery Rhymes : Illustrated Traditional Nursery Rhymes,Wonder House Books,4.6 out of 5 stars,"4,148",₹178.00,Board book
106,The Richest Man In Babylon - Fingerprint!,George S. Clason,4.5 out of 5 stars,"43,440",₹98.00,Paperback
107,Price Action Trading : Technical Analysis Simplified! by Sunil Gurjar (Chartmojo) - Chart Patterns | Candlestick Patterns | Breakout Patterns & Lot More !,Sunil Gurjar (Chartmojo),4.3 out of 5 stars,"2,264",₹316.00,Paperback
108,"108 Panchatantra Stories for Children (Illustrated) - Story Book for Kids - Moral Stories - Bedtime Stories - 3 Years to 10 Years Old - English Short Stories for Children - Read Aloud to Infants, Toddlers",Maple Press,4.4 out of 5 stars,"3,896",₹110.00,Paperback
109,The Almanack Of Naval Ravikant: A Guide to Wealth and Happiness,Eric Jorgenson,4.6 out of 5 stars,"15,993",₹264.00,Paperback
110,Arthashastra,KAUTILYA,4.4 out of 5 stars,"1,216",₹198.00,Paperback
111,"MTG International Mathematics Olympiad (IMO) Workbook for Class 5 - MCQs, Previous Years Solved Paper and Achievers Section - SOF Olympiad Preparation Books For 2023-2024 Exam",MAHABIR SINGH,4.6 out of 5 stars,217,₹65.00,Paperback
112,The Complete Novel of Sherlock Holmes,Arthur Conan Doyle,4.4 out of 5 stars,"19,726",₹168.00,Paperback
113,Math Concept King All Formulas and Theorum Latest 2023 Edition | Gagan Pratap Sir | Champion Publication,Gagan Pratap Sir,4.2 out of 5 stars,659,₹120.00,Perfect Paperback
114,"Jumbo Colouring Book - Activity Colouring Book for 3 to 5 years old kids - Gift to children for painting, drawing and colouring with reference guide [Paperback] Maple Press",Maple Press,4.4 out of 5 stars,"1,795",₹93.00,Paperback
115,"My First Shaped Board book - Elephant, Die-Cut Animals, Picture Book for Children",Wonder House Books,4.5 out of 5 stars,464,₹88.00,Board book
116,Arihant All In One Class 12th English Core for CBSE Exam 2024,Vaishali Jaiswal Srishti Agarwal ,4.4 out of 5 stars,214,₹332.00,Paperback
117,Win Your Inner Battles,Darius Foroux,4.5 out of 5 stars,"2,576",₹118.00,Paperback
118,"Atomic Habits: Chote Badlav, Asadharan Parinaam - Hindi",Sudhir Dixit,4.5 out of 5 stars,"3,147",₹228.00,Paperback
119,"Oswaal CBSE 10 Previous Years' Solved Papers, Class 10 (Mathematics Standard, Science, Sanskrit, Computer Applications, English Lang. & Lit. & Social Science) (For 2024 Exam)",Oswaal Editorial Board,4.6 out of 5 stars,164,₹720.00,Paperback
120,Arihant CBSE Chapterwise Solved Papers 2023-2010 Physics Class 12th,Punya Pratap SK Singh ,4.4 out of 5 stars,51,₹224.00,Paperback
121,"The Power of One Thought : Master Your Mind, Master Your Life",BK Shivani,4.8 out of 5 stars,312,₹203.00,Paperback
122,"Oswal - Gurukul 10 Years Solved Papers for ICSE 10 Exam 2024 - Comprehensive Handbook of 17 Subjects - Yearwise Board Solutions, Revised Syllabus",Oswal - Gurukul,4.4 out of 5 stars,169,₹837.00,Paperback
123,Brain Boosting Activity Book for Kids – 200+ Activities for Age 3+,Maple Press,4.5 out of 5 stars,"1,088",₹85.00,Paperback
124,"Time And Self Management, टाइम मैनेजमेंट बुक Book in Marathi, Books, मराठी पुस्तके, Veleche Vyavasthapan and Student Bindra, वेळेचे व्यवस्थापन Book टाईम मॅनेजमेंट पुस्तक, ani Safalta Vivek मॅनेजेंट पुस्तकं, बुक्स, Self Help, Selfhelp, Kanchan Dixit, कांचन दिक्षित, दीक्षित",Kanchan Dixit,5.0 out of 5 stars,1,₹212.00,Paperback
125,Dopamine Detox. (Original Imported Book),PIRATED BOOK,4.0 out of 5 stars,104,₹89.00,Paperback
126,"MTG International Mathematics Olympiad (IMO) Workbook for Class 3 - MCQs, Previous Years Solved Paper and Achievers Section - SOF Olympiad Preparation Books For 2023-2024 Exam",MAHABIR SINGH,4.5 out of 5 stars,702,₹65.00,Paperback
127,Oswaal CBSE Sample Question Papers Class 10 Social Science Book (For Board Exams 2024) | 2023-24,Oswaal Editorial Board,4.9 out of 5 stars,36,₹290.00,Paperback
128,Srimad Bhagavad Gita (HINDI),RR Varma,4.5 out of 5 stars,"1,713",₹229.00,Paperback
129,"MTG Objective NCERT at your FINGERTIPS Chemistry - NCERT Notes with HD Pages, Based on NCERT Exam Archive Questions, NEET-JEE Books (Latest & Revised Edition 2023-2024)",MTG Editorial Board,4.4 out of 5 stars,397,₹529.00,Paperback
130,Oswaal CBSE Class 10 Social Science Question Bank (For 2024 Board Exams),Oswaal Editorial Board,4.4 out of 5 stars,414,₹473.00,Paperback
131,The Monk Who Sold His Ferrari,Robin Sharma,4.5 out of 5 stars,"32,787",₹185.95,Paperback
